### ISSUE TITLE
KNI 接口不支持tcp协议

### ISSUE THREAD

**Issue by citycat2014** [baidu/dperf#539]
os：CentOS Linux release 7.2.1511 (Core)
dpdk: dpdk-stable-19.11.14

topo：
client（11.1.1.11/24）----（11.1.2.1/24）sw（11.1.1.1/24）---（dperf0： 11.1.1.12/24）server

server 配置：

```
mode        server
cpu          0
kni
#cpu         0-4
duration     48h
socket_mem      81920,0
payload_size    1400
port        0000:31:00.0    11.1.1.12   11.1.1.2
client      11.1.1.3       9
#client      11.1.2.12      20
server      11.1.1.13      200
listen      80              1
rss         auto
```

在server端 用nc 监听80端口：nc -l 11.1.1.12 80 -v 同时使用tcpdump抓dperf0口的包
在client端 访问 server的dperf0： nc 11.1.1.12 80 -v，超时
server上抓包查看，tcp syn 包有到达dperf0 但是没有回syn+ack，具体抓包如下：
tcpdump -ni dperf0
tcpdump: verbose output suppressed, use -v or -vv for full protocol decode
listening on dperf0, link-type EN10MB (Ethernet), capture size 65535 bytes
16:45:12.250777 ARP, Request who-has 11.1.1.1 tell 11.1.1.2, length 46
16:45:16.194773 IP 11.1.2.11.59436 > 11.1.1.12.http: Flags [S], seq 15333983, win 29200, options [mss 1460,sackOK,TS val 2751879543 ecr 0,nop,wscale 7], length 0
16:45:17.195772 IP 11.1.2.11.59436 > 11.1.1.12.http: Flags [S], seq 15333983, win 29200, options [mss 1460,sackOK,TS val 2751880544 ecr 0,nop,wscale 7], length 0
16:45:17.251773 ARP, Request who-has 11.1.1.1 tell 11.1.1.2, length 46
16:45:19.199772 IP 11.1.2.11.59436 > 11.1.1.12.http: Flags [S], seq 15333983, win 29200, options [mss 1460,sackOK,TS val 2751882548 ecr 0,nop,wscale 7], length 0
16:45:22.251772 ARP, Request who-has 11.1.1.1 tell 11.1.1.2, length 46
16:45:23.211771 IP 11.1.2.11.59436 > 11.1.1.12.http: Flags [S], seq 15333983, win 29200, options [mss 1460,sackOK,TS val 2751886560 ecr 0,nop,wscale 7], length 0
16:45:27.251772 ARP, Request who-has 11.1.1.1 tell 11.1.1.2, length 46
^C

**Comment by pengjianzhang** [comment]
这是符合预期的，dperf并不处理 kni接口上的报文，只是转发；如果你要80端口有响应，你需要自己启动http服务。
通常kni用来ssh连接的。

**Comment by citycat2014** [comment]
在server上通过nc工具监听了对应的80端口。
[root@xx]# netstat -pant |grep 80
tcp        0      0 11.1.1.12:80            0.0.0.0:*               LISTEN      20536/nc
[root@xx]# ifconfig dperf0
dperf0: flags=4163<UP,BROADCAST,RUNNING,MULTICAST>  mtu 1500
        inet 11.1.1.12  netmask 255.255.255.0  broadcast 0.0.0.0
        inet6 fe80::a288:c2ff:fe33:59b4  prefixlen 64  scopeid 0x20<link>
        ether a0:88:c2:33:59:b4  txqueuelen 1000  (Ethernet)
        RX packets 2267  bytes 185348 (181.0 KiB)
        RX errors 0  dropped 400  overruns 0  frame 0
        TX packets 8  bytes 648 (648.0 B)
        TX errors 0  dropped 0 overruns 0  carrier 0  collisions 0
更近一步测试，kni口ping网关不通，原因是网关响应arp后 kni口无法学习到对应的arp
[# ping 11.1.1.1
PING 11.1.1.1 (11.1.1.1) 56(84) bytes of data.
From 11.1.1.11 icmp_seq=1 Destination Host Unreachable
From 11.1.1.11 icmp_seq=2 Destination Host Unreachable
From 11.1.1.11 icmp_seq=3 Destination Host Unreachable
From 11.1.1.11 icmp_seq=4 Destination Host Unreachable
^C
--- 11.1.1.1 ping statistics ---
6 packets transmitted, 0 received, +4 errors, 100% packet loss, time 5000ms
pipe 4
# ping 11.1.1.1
PING 11.1.1.1 (11.1.1.1) 56(84) bytes of data.
^C
--- 11.1.1.1 ping statistics ---
3 packets transmitted, 0 received, 100% packet loss, time 1999ms
# tcpdump -ni dperf0
tcpdump: verbose output suppressed, use -v or -vv for full protocol decode
listening on dperf0, link-type EN10MB (Ethernet), capture size 65535 bytes
18:26:36.759773 ARP, Reply 11.1.1.1 is-at c0:b8:e6:ff:6a:d6, length 46
18:26:37.289773 ARP, Request who-has 11.1.1.1 tell 11.1.1.2, length 46
18:26:37.759773 ARP, Reply 11.1.1.1 is-at c0:b8:e6:ff:6a:d6, length 46 ---有arp响应，返回
18:26:38.761771 ARP, Reply 11.1.1.1 is-at c0:b8:e6:ff:6a:d6, length 46
18:26:40.759772 ARP, Reply 11.1.1.1 is-at c0:b8:e6:ff:6a:d6, length 46
18:26:41.761771 ARP, Reply 11.1.1.1 is-at c0:b8:e6:ff:6a:d6, length 46
18:26:42.289772 ARP, Request who-has 11.1.1.1 tell 11.1.1.2, length 46
18:26:42.763773 ARP, Reply 11.1.1.1 is-at c0:b8:e6:ff:6a:d6, length 46
# arp -a
? (11.1.1.4) at a0:88:c2:33:52:d0 [ether] on eth2
? (11.1.1.9) at a0:88:c2:33:52:d0 [ether] on eth2
? (11.1.1.5) at a0:88:c2:33:52:d0 [ether] on eth2
? (11.1.1.1) at <incomplete> on eth2 ------------------没学习到arp条目
? (11.1.1.10) at a0:88:c2:33:52:d0 [ether] on eth2
? (11.1.1.6) at a0:88:c2:33:52:d0 [ether] on eth2
? (11.1.1.2) at a0:88:c2:33:52:d0 [ether] on eth2
? (11.1.1.7) at a0:88:c2:33:52:d0 [ether] on eth2
? (11.1.1.8) at a0:88:c2:33:52:d0 [ether] on eth2
? (11.1.1.3) at a0:88:c2:33:52:d0 [ether] on eth2

**Comment by pengjianzhang** [comment]
试试v1.7.0

**Comment by citycat2014** [comment]
v1.7.0在我这儿跑不起来，200G内存，启动时会将内存耗尽而失败，而且失败后不回释放内存。 只能重启机器恢复
[ ~]$  cat /proc/meminfo | grep Huge
AnonHugePages:    354304 kB
HugePages_Total:     218 
HugePages_Free:      218 -------->218G 空闲内存
HugePages_Rsvd:        0
HugePages_Surp:        0
Hugepagesize:    1048576 kB

[]$ cd dperf1.7
[]$ cat test/kni/kni.conf
#kni            vEth
#kni            vnic
#kni            dperf
# kni
mode            server
cpu             0-3
tx_burst        128
launch_num      10
payload_size    1
duration       	10d
#port           pci             addr            gateway
port            0000:31:00.1    11.1.2.12    11.1.2.1 c0:b8:e6:ff:6a:d6

#               addr_start      num
client          11.1.1.12 	10
#               addr_start      num
server          11.1.2.12       4
#               port_start      num
listen          80              1

[]$ lspci |grep -i eth
17:00.0 Ethernet controller: Mellanox Technologies MT27800 Family [ConnectX-5]
17:00.1 Ethernet controller: Mellanox Technologies MT27800 Family [ConnectX-5]
31:00.0 Ethernet controller: Mellanox Technologies Device 101d
31:00.1 Ethernet controller: Mellanox Technologies Device 101d
[]$ sudo ./build/dperf -c test/kni/kni.conf
EAL: Could not find space for memseg. Please increase CONFIG_RTE_MAX_MEMSEG_PER_TYPE and/or CONFIG_RTE_MAX_MEM_MB_PER_TYPE in configuration.
EAL: Couldn't remap hugepage files into memseg lists
EAL: FATAL: Cannot init memory
EAL: Cannot init memory
rte_eal_init fail
dpdk_eal_init fail
dpdk init fail
[]$  sleep 60;cat /proc/meminfo | grep Huge
AnonHugePages:    468992 kB
HugePages_Total:     218
HugePages_Free:        0 -------->全部耗尽且不释放
HugePages_Rsvd:        0
HugePages_Surp:        0
Hugepagesize:    1048576 kB

[]$ ps -ef |grep dperf
xx  7748  5488  0 22:38 pts/1    00:00:00 grep --color=auto dperf
[]$

**Comment by pengjianzhang** [comment]
最新代码 用一个CPU 试试

**Comment by citycat2014** [comment]
用v1.8.0 和 main最新代码只用一个CPU试了，还是和之前测试的结果一样。对dpdk版本有要求么，我用的dpdk-stable-19.11.14
```
#kni            vEth
#kni            vnic
#kni            dperf
kni
protocol udp
#socket_mem      0,81920
mode            server
cpu             0
tx_burst        128
launch_num      10
payload_size    1
duration       	10d
#port           pci             addr            gateway
port            0000:31:00.1    11.1.2.12    11.1.2.1 c0:b8:e6:ff:6a:d6
#               addr_start      num
client          6.6.242.155 	100
#               addr_start      num
server          11.1.2.13       1
#               port_start      num
listen          80              1
```

**Comment by pengjianzhang** [comment]
我用DPDK 25.03测试是OK的
不需要加载kni模块
