### ISSUE TITLE
客户端连不上服务端

### ISSUE THREAD

**Issue by Hosers** [baidu/dperf#48]
服务启动信息如下：
[root@localhost dperf-main]# ./build/dperf -c test/http/server-cps.conf
EAL: Detected 2 lcore(s)
EAL: Detected 1 NUMA nodes
EAL: Multi-process socket /var/run/dpdk/rte/mp_socket
EAL: Selected IOVA mode 'PA'
EAL: No available hugepages reported in hugepages-1048576kB
EAL: Probing VFIO support...
EAL: PCI device 0000:00:14.0 on NUMA socket -1
EAL:   probe driver: 8086:100e net_e1000_em
socket allocation succeeded, size 0.01GB num 131070
Get gateway's MAC address successfully

seconds 0                  cpuUsage 0
pktRx   0                  pktTx    0                  bitsRx   0                  bitsTx  0                  dropTx  0
arpRx   0                  arpTx    0                  icmpRx   0                  icmpTx  0                  otherRx 0          badRx 0
synRx   0                  synTx    0                  finRx    0                  finTx   0                  rstRx   0          rstTx 0
synRt   0                  finRt    0                  ackRt    0                  pushRt  0                  tcpDrop 0
skOpen  0                  skClose  0                  skCon    0                  skErr   0
httpGet 0                  http2XX  0                  httpErr  0
ierrors 0                  oerrors  0                  imissed  0

获取网关地址：
16:55:23.121987 ARP, Request who-has 6.6.241.1 tell 6.6.241.11, length 46
16:55:23.121989 ARP, Request who-has 6.6.241.1 tell 6.6.241.11, length 46
16:55:23.121990 ARP, Reply 6.6.241.1 is-at 66:fe:68:7e:19:25, length 46
16:55:23.121992 ARP, Reply 6.6.241.1 is-at 66:fe:68:7e:19:25, length 46

请求 http://6.6.241.11 连接超时，客户端使用连接不上服务

使用版本如下：
dpdk-stable-19.11.11
dperf-main 最新代码

感谢！！！@pengjianzhang

**Comment by pengjianzhang** [comment]
客户端地址需要写在服务器的配置中

**Comment by pengjianzhang** [comment]
客户端ping一下服务器，看下通不通

**Comment by Hosers** [comment]
[root@localhost dperf-main]# cat test/http/server-cps.conf
mode        server
cpu         0
duration    10m
port        0000:00:14.0    6.6.241.11  6.6.241.1
client      6.6.242.101       2
server      6.6.241.11      1
listen      80              1


客户端设备pnig不通服务端，服务端ping自己也不通

**Comment by pengjianzhang** [comment]
客户端地址是多少

**Comment by pengjianzhang** [comment]
如果没有三层交换机或者网关，你把客户端、dperf服务器配置在同一个地址段，dperf服务器的port的网关参数配置成客户端地址，MAC配成客户端的MAC

**Comment by pengjianzhang** [comment]
例如客户端是 192.168.4.2  MAC地址 00:01:02:03:04:05
dperf的地址是 192.168.4.3 
dperf配置可以这样
--------------
mode server
cpu 0 
port xxxxx 192.168.4.3 192.168.4.2 00:01:02:03:04:05
client 192.168.4.2 1
server 192.168.4.3 1
listen 80

**Comment by Hosers** [comment]
解决了，非常感谢您的热心回答😃

**Comment by pengjianzhang** [comment]
不客气，能加个star吗，谢谢

**Comment by pengjianzhang** [comment]
方便说一下，您用dperf的场景吗

**Comment by Hosers** [comment]
加了。
这边用于工控、物联网行业以太网协议并发、吞吐性能测试，
dperf测试四层非常实用，不知道大牛后续dperf是否会规划支持其他应用协议啊😜

**Comment by pengjianzhang** [comment]
谢谢
主要还是四层吧，感觉应用层测试用普通工具就够了

**Comment by pengjianzhang** [comment]
后续主要加强对交换机测试的支持

**Comment by pengjianzhang** [comment]
有啥需求 欢迎提出来

**Comment by Hosers** [comment]
> 有啥需求 欢迎提出来
我在深入学习下，后面有好的想法再沟通

**Comment by Hosers** [comment]
嗨，我按照两台设备直连方式测试http协议，服务端、客户端启动后，开始打印结果如下：
pktRx   183,861            pktTx    445,616            bitsRx   145,825,008        bitsTx  238,394,080        dropTx  0
arpRx   858                arpTx    858                icmpRx   0                  icmpTx  0                  otherRx 0          badRx 0
**synRx   61,036             synTx    322,739**            finRx    60,987             finTx   60,987             rstRx   0          rstTx 0
synRt   196,050            finRt    3                  ackRt    0                  pushRt  36                 tcpDrop 7
skOpen  126,689            skClose  123,657            skCon    3,032              skErr   62,677
**httpGet 61,032             http2XX  60,984**             httpErr  0
ierrors 0                  oerrors  0                  imissed  23,360

过几分钟后，客/服端进程都在运行，客户端输出中synRx 就是0了，这可能是什么原因导致的啊？客户端我现在只配置1个ip地址
seconds 144                cpuUsage 18
pktRx   0                  pktTx    1,999              bitsRx   0                  bitsTx  927,536            dropTx  0
arpRx   0                  arpTx    0                  icmpRx   0                  icmpTx  0                  otherRx 0          badRx 0
**synRx   0                  synTx    1,999**              finRx    0                  finTx   0                  rstRx   0          rstTx 0
synRt   1,999              finRt    0                  ackRt    0                  pushRt  0                  tcpDrop 0
skOpen  0                  skClose  1,006              skCon    3,988              skErr   1,006
**httpGet 0                  http2XX  0**                  httpErr  0
ierrors 0                  oerrors  0                  imissed  23,200

**Comment by pengjianzhang** [comment]
重传很高 synRt 196,050， imissed 23,360 丢包很严重
你的目标舍得是多少
贴一下配置

**Comment by Hosers** [comment]
我是在PVE中搭的虚拟环境，带宽千兆自适应的，实际交互的数据 看监控软件每秒500Kbps

**Comment by pengjianzhang** [comment]
看来网络带宽不够，需要把压力调小

**Comment by pengjianzhang** [comment]
推荐用万兆网络环境进行测试

**Comment by Hosers** [comment]
我在PVE里面单独搭的局域网，利用率很低，除了带宽，还可能有啥问题不？

**Comment by pengjianzhang** [comment]
你把压力调低 试一下，另外虚拟网络中 CPS受限于虚拟网络，也打不高
