### ISSUE TITLE
v1.6.0 及之后的版本 TCP 连接无法正确释放

### ISSUE THREAD

**Issue by Sean-Pearce** [baidu/dperf#386]
测试环境：dpdk 20.11
测试配置：自带 server-cps 配置

具体表现是，client 发送 fin 包后，server 返回错误的 seq 和 ack，导致 client 持续尝试重传上一个 fin 包，此时 server 侧连接已释放，stats 中显示 tcpDrop。替换到 v1.5.0 版本后此问题消失。
怀疑与 2023.10.6 的修改有关。
https://github.com/baidu/dperf/blob/870c7acf15969174da0ed6d44408c49503a273ba/src/tcp.c#L162

12:17:38.092508 IP 10.0.0.200.36756 > 47.102.154.210.81: Flags [S], seq 1046450525, win 64240, options [mss 1460,sackOK,TS val 489076815 ecr 0,nop,wscale 7], length 0
........>.<K..E..<y.@.@..,
.../f.....Q>_.]...................
.&.O........
12:17:38.095784 IP 47.102.154.210.81 > 10.0.0.200.36756: Flags [S.], seq 459382020, ack 1046450526, win 58400, options [mss 1460,nop,wscale 13], length 0
..>.<K........E..0.B@.?.fr/f..
....Q...a..>_.^p.. ...........
12:17:38.095795 IP 10.0.0.200.36756 > 47.102.154.210.81: Flags [.], ack 1, win 502, length 0
........>.<K..E..(y.@.@..?
.../f.....Q>_.^.a..P.......
12:17:38.095808 IP 10.0.0.200.36756 > 47.102.154.210.81: Flags [P.], seq 1:82, ack 1, win 502, length 81
........>.<K..E..yy.@.@...
.../f.....Q>_.^.a..P....k..GET / HTTP/1.1
Host: 47.102.154.210:81
User-Agent: curl/7.61.1
Accept: */*

12:17:38.099059 IP 47.102.154.210.81 > 10.0.0.200.36756: Flags [FP.], seq 1:85, ack 82, win 58400, length 84
..>.<K........E..|.C@.?.f%/f..
....Q...a..>_..P.. .2..HTTP/1.1 200 OK
Content-Length:         14
Connection:keep-alive

hello dperf!

12:17:38.099084 IP 10.0.0.200.36756 > 47.102.154.210.81: Flags [F.], seq 82, ack 86, win 502, length 0
........>.<K..E..(y.@.@..=
.../f.....Q>_...a.ZP.......
12:17:38.102248 IP 47.102.154.210.81 > 10.0.0.200.36756: Flags [.], ack 3248516771, win 58400, length 0  // 这里 ack 序号错误
..>.<K........E..(.D@.?.fx/f..
....Q...a.Z....P.. ..........
12:17:38.102252 IP 10.0.0.200.36756 > 47.102.154.210.81: Flags [.], ack 86, win 502, length 0
........>.<K..E..(y.@.@..<
.../f.....Q>_...a.ZP.......
12:17:38.310238 IP 10.0.0.200.36756 > 47.102.154.210.81: Flags [F.], seq 82, ack 86, win 502, length 0
........>.<K..E..(y.@.@..;
.../f.....Q>_...a.ZP.......
12:17:38.726236 IP 10.0.0.200.36756 > 47.102.154.210.81: Flags [F.], seq 82, ack 86, win 502, length 0
........>.<K..E..(y.@.@..:
.../f.....Q>_...a.ZP.......
12:17:39.606236 IP 10.0.0.200.36756 > 47.102.154.210.81: Flags [F.], seq 82, ack 86, win 502, length 0

**Comment by pengjianzhang** [comment]
请说明环境 测试方法  配置 谢谢

**Comment by Sean-Pearce** [comment]
v1.7.0 测试结果（与 1.6.0 相同）
![image](https://github.com/baidu/dperf/assets/10493266/35ead87d-c0b5-4622-82d6-e53b4277192b)

v1.5.0 测试结果
![image](https://github.com/baidu/dperf/assets/10493266/3d8a72bb-ae74-425d-a279-2639cb551e99)

**Comment by pengjianzhang** [comment]
已经修复
请加个star吧
谢谢
